{
  "schema_version": "1.0.0",
  "task_id": "CTRL-001",
  "agent_id": "codex-main",
  "branch": "lane/CTRL-001/codex-main",
  "base_sha": "622c8783060cb64970e7c8952d51ca7c50307edd",
  "lease_generation": 1,
  "tested_code_sha": "36ae95abd38c4f90d9132c9669afcdeda4a82f2b",
  "status": "READY_FOR_REVIEW",
  "summary": "Added the permanent orchestrator queue route on control/codex-main. It permits only atomic TASKS, LOG, STATE, and optional OWNERS ledger updates; rejects stale bases, transient forbidden history, invalid candidate context pins, and expired candidate leases; and preserves mandatory handoffs and acceptance for ordinary implementation lanes.",
  "changed_paths": [
    ".agents/handoffs/CTRL-001.json",
    ".github/workflows/agent-control.yml",
    ".github/workflows/agent-regression.yml",
    "AGENTS.md",
    "OWNERS.md",
    "test/governance/agent-policy-hardening.test.js",
    "tools/coordination/assert-pr-scope.mjs",
    "tools/coordination/control-plane.mjs",
    "tools/coordination/repository-policy.mjs"
  ],
  "pre_change_proof": [
    {
      "check_id": "governance-tests",
      "command": [
        "node",
        "--test",
        "test/governance/agent-control.test.js",
        "test/governance/agent-policy-hardening.test.js",
        "test/governance/scan-pr-diff-history.test.js"
      ],
      "result": "FAIL",
      "evidence": "The changed queue-lifecycle governance tests were applied to the trusted pre-change implementation and failed before the permanent orchestrator route existed."
    }
  ],
  "post_change_proof": [
    {
      "check_id": "governance-tests",
      "command": [
        "node",
        "--test",
        "test/governance/agent-control.test.js",
        "test/governance/agent-policy-hardening.test.js",
        "test/governance/scan-pr-diff-history.test.js"
      ],
      "result": "PASS",
      "evidence": "Exact tested code SHA 36ae95a passed the complete governance suite; the focused queue lifecycle regression passed 7 of 7 cases under independent adversarial review."
    },
    {
      "check_id": "board-validation",
      "command": [
        "node",
        "tools/coordination/validate-board.mjs",
        "--board-only"
      ],
      "result": "PASS",
      "evidence": "The checked-in board passed schema, lease, dependency, ownership, command-shape, and acceptance validation."
    },
    {
      "check_id": "diff-hygiene",
      "command": [
        "git",
        "diff",
        "--check",
        "$TASK_BASE_SHA...$TESTED_CODE_SHA"
      ],
      "result": "PASS",
      "evidence": "Git diff hygiene passed for integration base 309a564 through exact tested code 36ae95a."
    }
  ],
  "adversarial_review": {
    "goal": "Find fail-open routes in permanent queue scope, introduced history, stale-base handling, candidate context validation, lease recovery, prior-handoff drift classification, ordinary-lane handoffs, acceptance, or weakened checks.",
    "result": "PASS",
    "reviewer_id": "adversarial_control_plane",
    "reviewed_code_sha": "36ae95abd38c4f90d9132c9669afcdeda4a82f2b"
  },
  "weakened_checks": [],
  "open_risks": [
    {
      "code": "GITHUB_FREE_ENFORCEMENT",
      "severity": "WARNING",
      "description": "The current private-repository plan cannot enforce required checks or CODEOWNERS; codex-main remains the sole merger."
    },
    {
      "code": "SHARED_ACTOR_IDENTITY",
      "severity": "WARNING",
      "description": "Shared GitHub credentials make agent and reviewer identifiers routing labels rather than cryptographic identities."
    },
    {
      "code": "PRODUCT_BASE_NOT_GREEN",
      "severity": "WARNING",
      "description": "The current product base exceeds the target two-failure ceiling; CTRL-001 is control-only and does not claim to repair product tests."
    },
    {
      "code": "LOCAL_FULL_SUITE_RESOURCE_REFUSAL",
      "severity": "INFO",
      "description": "The local full product suite remains resource-refused; focused governance checks are complete and product regression is classified separately."
    }
  ]
}
